{
  "schema_version": "pdx_phase0_e05_route_mapping_v1",
  "base_path": "/internal/v1",
  "error_schema": "pdx_internal_error_v1",
  "routes": [
    {
      "method": "POST",
      "path": "/internal/v1/jobs",
      "request_schema": "pdx_internal_job_create_v1",
      "request_example": "examples/job_create.intake_document.json",
      "success_status": 202,
      "success_schema": "pdx_internal_job_status_v1",
      "success_example": "examples/job_status.pending.json",
      "conflict_status": 409,
      "validation_status": 400
    },
    {
      "method": "GET",
      "path": "/internal/v1/jobs/{job_id}",
      "request_schema": null,
      "request_example": null,
      "success_status": 200,
      "success_schema": "pdx_internal_job_status_v1",
      "success_example": "examples/job_status.pending.json",
      "not_found_status": 404
    },
    {
      "method": "POST",
      "path": "/internal/v1/jobs/{job_id}/cancel",
      "request_schema": "pdx_internal_job_cancel_v1",
      "request_example": "examples/job_cancel.request.json",
      "success_status": 200,
      "success_schema": "pdx_internal_job_status_v1",
      "success_example": "examples/job_status.cancelled.json",
      "conflict_status": 409,
      "not_found_status": 404
    },
    {
      "method": "POST",
      "path": "/internal/v1/jobs/{job_id}/reconcile",
      "request_schema": "pdx_internal_job_reconcile_v1",
      "request_example": "examples/job_reconcile.request.json",
      "success_status": 200,
      "success_schema": "pdx_internal_job_status_v1",
      "success_example": "examples/job_status.pending.json",
      "not_found_status": 404
    }
  ]
}
